{
  "schemaVersion": 2,
  "resultId": "3f10950bbd55e0ae3d757f3abeb88cae1a56285b5d75b2970f07817d1161e109",
  "collection": {
    "role": "branch-trace-collection",
    "digest": "e68015eb8a899323f734f45287567305201e112ad89ee012e14bf58fa5558021"
  },
  "patternSource": {
    "role": "pattern-source",
    "digest": "ed9ae3907d39b5d29809163ea7d272745a559504a408083b9edab6a9b5d267da"
  },
  "patternPlan": {
    "role": "pattern-plan",
    "digest": "8a2359f706a8434cc3eaaf274850134e6095a79721b442c29e0765ef1ce080d0"
  },
  "patternQuery": {
    "role": "pattern-query",
    "digest": "117f9df30cc586da7c800df5d28522d1b74403aae300071e92242515d6b761cc"
  },
  "sideConditionTable": {
    "role": "side-condition-conformance-table",
    "digest": "6016b7960b0103c9b60f2419798f8419394f965f861241f6fa947540d49988bd"
  },
  "searchPolicy": "existential-first",
  "pathResults": [
    {
      "visitOrdinal": 0,
      "branchKey": "e8341ea8b5abacc769cf19ff9a04bf0362db6dea54a188a89c74d4d31174bcf5",
      "trace": {
        "role": "event-trace",
        "digest": "75ba3d3d3edab4a9d6a527c0b13f23db58158048e592bb714ed6c5138958c1cc"
      },
      "traceOccurrence": "7e5fb8065106bdd32dd7b6a5b01dafae6b8c6f5d7b2cdbe8fdc04adb878ab7cc",
      "disposition": {
        "kind": "normal",
        "terminal": {
          "role": "terminal-state",
          "digest": "00958626001fc0db84da9145e7d654b51eba797f406aeab94ceb4d30237dc3fb"
        }
      },
      "evaluation": {
        "kind": "trustworthy",
        "status": "no-match",
        "denotation": {
          "candidateCount": 0,
          "indeterminateCandidateCount": 0
        },
        "witnesses": []
      }
    }
  ],
  "witnesses": [],
  "decision": {
    "kind": "no-match",
    "completeCoverage": true
  }
}
