{
  "schemaVersion": 2,
  "resultId": "1428654126dac0881a21856730a923ede07a96b91c6ff2c133ecc63579c1b8d9",
  "collection": {
    "role": "branch-trace-collection",
    "digest": "da2c87af5803ea447beef527225f0c86ecd1cb074c35459b3a32aa905e4c8047"
  },
  "patternSource": {
    "digest": "ed9ae3907d39b5d29809163ea7d272745a559504a408083b9edab6a9b5d267da",
    "role": "pattern-source"
  },
  "patternPlan": {
    "digest": "4d87f47a3141fd70e3bdbc55a7cb565932c61bc924832ab0b143c7ab12d07806",
    "role": "pattern-plan"
  },
  "patternQuery": {
    "role": "pattern-query",
    "digest": "66ea90f89ca9d344d801f569ca0d6dcac87bba682b516370c1e7286440f33434"
  },
  "sideConditionTable": {
    "role": "side-condition-conformance-table",
    "digest": "6016b7960b0103c9b60f2419798f8419394f965f861241f6fa947540d49988bd"
  },
  "searchPolicy": "exhaustive",
  "pathResults": [
    {
      "visitOrdinal": 0,
      "branchKey": "a04701081827918caa87ca72bfb059d90245d8a29b7cead6b2a5c0a3a87a8f74",
      "trace": {
        "role": "event-trace",
        "digest": "ad30fe5264e3de54a7e43bdae4eeab5f0463a4008d2ea1ffc1a586eec9b6f5c8"
      },
      "traceOccurrence": "790f459f0d105d8cd719159fb73fb174d5f66fcfd3eb634c6ad64f721307ce35",
      "disposition": {
        "kind": "normal",
        "terminal": {
          "role": "terminal-state",
          "digest": "00958626001fc0db84da9145e7d654b51eba797f406aeab94ceb4d30237dc3fb"
        }
      },
      "evaluation": {
        "kind": "trustworthy",
        "status": "unknown",
        "denotation": {
          "candidateCount": 1,
          "indeterminateCandidateCount": 1
        },
        "witnesses": []
      }
    }
  ],
  "witnesses": [],
  "decision": {
    "kind": "unknown",
    "completeCoverage": false,
    "reason": {
      "kind": "indeterminate-denotation",
      "firstIndeterminate": {
        "collection": {
          "role": "branch-trace-collection",
          "digest": "da2c87af5803ea447beef527225f0c86ecd1cb074c35459b3a32aa905e4c8047"
        },
        "visitOrdinal": 0,
        "branchKey": "a04701081827918caa87ca72bfb059d90245d8a29b7cead6b2a5c0a3a87a8f74",
        "traceOccurrence": "790f459f0d105d8cd719159fb73fb174d5f66fcfd3eb634c6ad64f721307ce35"
      }
    }
  }
}
