{
  "schemaVersion": 2,
  "resultId": "d7fae4de44f57ff14e598e20f6ef183644dd26e7711cdfdad34d0567cf386d4f",
  "collection": {
    "role": "branch-trace-collection",
    "digest": "13f9254d3182d687af231a19b443968a59a5a0a5a3bd1be80f5732831177c4e1"
  },
  "patternSource": {
    "role": "pattern-source",
    "digest": "ed9ae3907d39b5d29809163ea7d272745a559504a408083b9edab6a9b5d267da"
  },
  "patternPlan": {
    "role": "pattern-plan",
    "digest": "8a2359f706a8434cc3eaaf274850134e6095a79721b442c29e0765ef1ce080d0"
  },
  "patternQuery": {
    "role": "pattern-query",
    "digest": "117f9df30cc586da7c800df5d28522d1b74403aae300071e92242515d6b761cc"
  },
  "sideConditionTable": {
    "role": "side-condition-conformance-table",
    "digest": "6016b7960b0103c9b60f2419798f8419394f965f861241f6fa947540d49988bd"
  },
  "searchPolicy": "exhaustive",
  "pathResults": [],
  "witnesses": [],
  "decision": {
    "kind": "no-match",
    "completeCoverage": true,
    "emptySearchDecision": {
      "role": "empty-search-decision",
      "digest": "71b7b396bcadfda21ce80639f068d8c45c0962951db1936e353de35fb66145e9"
    }
  }
}
